{"branding":{"accentColor":"#B45309","backgroundColor":"#FFFFFF","primaryColor":"#0F766E","textColor":"#1F2937"},"certificate":{"enabled":true,"message":"Has completed the Slips, Trips & Falls workplace safety module.","title":"Certificate of Completion"},"engineVersion":"0.1.0","flow":{"screens":[{"blocks":[{"html":"<p>Slips, trips, and falls are among the most common workplace incidents — and most of them are preventable. In the next few minutes you'll learn a simple 3-step response and then make a real decision in a scenario.</p>","type":"text"},{"items":["Recognize common slip, trip, and fall hazards","Apply the 3-step response: secure, report, follow up","Decide what to do when you spot a hazard under pressure"],"type":"list"},{"html":"<strong>How this works:</strong> read each screen, answer the check, then handle a realistic situation. Your choices change what happens next.","type":"callout"}],"id":"s1","title":"Stop the slip","type":"content"},{"correctOptionId":"o2","id":"s2","options":[{"feedback":"Unreported spills cause injuries within minutes. Walking past makes you part of the problem.","id":"o1","text":"Walk around it — someone else will handle it."},{"feedback":"Exactly. Secure first, then report or clean.","id":"o2","text":"Block the area and report it (or clean it if you're trained and it's safe)."},{"feedback":"Paper towels hide the hazard without removing it — and nobody knows it's there.","id":"o3","text":"Cover it with paper towels and leave."},{"feedback":"Waiting without blocking the area leaves everyone else exposed in the meantime.","id":"o4","text":"Stand nearby until the cleaning crew arrives."}],"points":10,"prompt":"You notice a spill spreading across a busy hallway. What is the best FIRST action?","title":"Quick check","type":"multipleChoice"},{"blocks":[{"alt":"Illustration of a blue liquid spill spreading across a hallway floor beside a yellow caution sign.","caption":"Secure the area first — then deal with the hazard.","src":"data:image/svg+xml,%3Csvg xmlns='http://www.w3.org/2000/svg' width='640' height='360' viewBox='0 0 640 360'%3E%3Crect width='640' height='360' fill='%23DCEFEA'/%3E%3Crect y='260' width='640' height='100' fill='%23BFD9D4'/%3E%3Cellipse cx='300' cy='292' rx='130' ry='20' fill='%237FB3D5'/%3E%3Cpolygon points='520,110 596,250 444,250' fill='%23F5B301'/%3E%3Crect x='514' y='160' width='12' height='52' fill='%23333333'/%3E%3Ccircle cx='520' cy='228' r='8' fill='%23333333'/%3E%3C/svg%3E","type":"image"},{"html":"<p>When you spot a slip, trip, or fall hazard, run the same three steps every time:</p>","type":"text"},{"items":["1. Secure the area — block it, warn people, put out a sign. Protect others before anything else.","2. Report or clean — tell your supervisor, or clean it yourself if you're trained and it's safe.","3. Follow up — make sure the root cause (the leak, the cord, the broken tile) actually gets fixed."],"type":"list"}],"id":"s3","title":"The 3-step response","type":"content"},{"choices":[{"feedback":"Strong call. You protected people immediately — and by reporting the leak itself, not just the puddle, you made sure it gets fixed instead of happening again tomorrow.","id":"c1","next":"s5","scoreDelta":10,"text":"Grab two chairs to block the wet area, then call your supervisor about the leak."},{"feedback":"Risky. There's no wet-floor sign, no report, and the cooler keeps leaking — the next person through hits a fresh puddle. Fast isn't the same as fixed.","id":"c2","next":"s5","scoreDelta":0,"text":"Mop it up quickly yourself and get back to work."}],"id":"s4","prompt":"It's 4:55 PM. Water is spreading from a leaking cooler near the break-room entrance. People are streaming out for the day, most of them looking at their phones. You're the only one who has noticed. What do you do?","title":"Decision point: 4:55 PM","type":"scenario"},{"failMessage":"Review the 3-step response and try again — protecting others starts with securing the area first.","id":"s5","passMessage":"You think like a safety owner: secure, report, follow up. That's the habit that prevents injuries.","showScore":true,"title":"Your results","type":"results"}],"startScreen":"s1"},"meta":{"author":"Payne Roberts","courseId":"slips-trips-falls-demo","description":"Demo course for the e-learning engine prototype. Five screens: content, a knowledge check, a two-branch scenario, and results.","estimatedMinutes":8,"language":"en","title":"Workplace Safety: Slips, Trips & Falls","version":"0.1.0"},"resources":[{"label":"OSHA: Fall prevention guidance","url":"https://www.osha.gov/fall-protection"}],"schemaVersion":"0.1.0","scoring":{"passingScore":70}}