{"branding":{"accentColor":"#C2410C","backgroundColor":"#FFFDF8","borderColor":"#E7E5E4","logo":{"alt":"CalmDesk Learning logo","src":"data:image/svg+xml,%3Csvg xmlns='http://www.w3.org/2000/svg' width='64' height='64' viewBox='0 0 64 64'%3E%3Crect width='64' height='64' rx='14' fill='%23164E63'/%3E%3Cpath d='M18 22h28v16H32l-8 8v-8h-6z' fill='white'/%3E%3C/svg%3E"},"mutedColor":"#78716C","primaryColor":"#164E63","textColor":"#1C1917"},"certificate":{"enabled":true,"message":"Has completed the De-escalation Basics customer-service module.","title":"Certificate of Completion"},"engineVersion":"0.2.0","flow":{"screens":[{"blocks":[{"html":"<p>An angry customer is on the line. Their voice is raised, and the first thirty seconds will decide whether this call ends with a solution or a complaint. This module gives you a simple way to stay in control when the other person isn't.</p>","type":"text"},{"items":["Hear the real problem underneath the anger","Use the 4-step method: hear them out, empathize, ask, resolve","Choose words that lower the temperature instead of raising it"],"type":"list"},{"html":"<strong>How this works:</strong> read each screen, answer the checks, then handle a heated call in a scenario. Your choices change what happens next.","type":"callout"}],"id":"s1","title":"The call is already hot","type":"content"},{"correctOptionId":"o1","id":"s2","options":[{"feedback":"Exactly. People can't hear solutions until they feel heard.","id":"o1","text":"Let them finish, then say what you heard in your own words."},{"feedback":"Policy first sounds like a wall. They'll only shout louder.","id":"o2","text":"Interrupt politely and read the billing policy."},{"feedback":"Matching their volume turns a complaint into a contest.","id":"o3","text":"Raise your voice slightly so they know you're serious."},{"feedback":"Hold feels like punishment when someone is already upset.","id":"o4","text":"Put them on hold for two minutes to cool off."}],"points":10,"prompt":"A customer starts the call shouting about a bill they say is wrong. What is your best FIRST move?","title":"Quick check: first move","type":"multipleChoice"},{"choices":[{"feedback":"Strong. You gave him something today and a clear path for the rest. Most people accept a two-step yes.","id":"c1","next":"s4","scoreDelta":10,"text":"Say: “I hear you — here’s what I can do right now, and here’s what I’ll get approved by tomorrow.” Then lay out both options."},{"feedback":"Safe, but cold. He heard “the computer says no” — and he’s already looking up your competitor.","id":"c2","next":"s4","scoreDelta":0,"text":"Repeat the policy word for word and tell him there’s nothing else you can do."},{"feedback":"That just happened — and now you have two problems: the refund, and the way you spoke to him. Words like “unreasonable” always cost you.","id":"c3","next":"s4","scoreDelta":-5,"text":"Tell him he’s being unreasonable and that shouting won’t change the policy."}],"id":"s3","prompt":"It’s minute four. Marcus has calmed down a little, but now he says: “I want a full refund, and I want it today, or I’m cancelling everything.” Company policy allows a partial credit — a full refund needs a supervisor’s approval, which takes 24 hours. What do you do?","title":"The refund demand","type":"scenario"},{"blocks":[{"html":"<p>When a conversation heats up, run the same four steps every time:</p>","type":"text"},{"items":["1. Hear them out — let them finish. Don’t interrupt, even to help.","2. Empathize out loud — “That sounds frustrating” costs nothing and buys everything.","3. Ask what good looks like — “What would fix this for you?” turns venting into problem-solving.","4. Resolve in steps — offer what you can do now, and name exactly what happens next."],"type":"list"},{"html":"<strong>Never say:</strong> “Calm down,” “That’s our policy,” or “There’s nothing I can do.” Each one adds fuel.","type":"callout"}],"id":"s4","title":"The de-escalation toolkit","type":"content"},{"correctOptionId":"o1","id":"s5","options":[{"feedback":"Exactly. Agreement plus action. That’s the whole game.","id":"o1","text":"“You’re right to be frustrated — let’s fix this together.”"},{"feedback":"Close, but it’s become wallpaper — customers hear it as a script.","id":"o2","text":"“I understand how you feel.”"},{"feedback":"“Tries its best” defends the company instead of helping the person in front of you.","id":"o3","text":"“Our team always tries its best.”"},{"feedback":"A transfer right now feels like being passed off, not helped.","id":"o4","text":"“Let me transfer you to someone who can help.”"}],"points":10,"prompt":"The customer says, “Nobody ever helps me with this.” Which reply rebuilds trust fastest?","title":"Quick check: rebuild trust","type":"multipleChoice"},{"failMessage":"Review the four steps — hear, empathize, ask, resolve — and try again. Calm is a skill, not a personality trait.","id":"s6","passMessage":"You stay calm under pressure and turn heat into progress. That’s the skill customers remember.","showScore":true,"title":"Your results","type":"results"}],"startScreen":"s1"},"meta":{"author":"Payne Roberts","courseId":"deescalation-basics-demo","description":"Second demo course for the e-learning engine. Six screens: content, two knowledge checks, a three-branch scenario with a negative-score choice, and results. Proves the engine renders any valid config.","estimatedMinutes":10,"language":"en","title":"Difficult Customer Conversations: De-escalation Basics","version":"0.1.0"},"schemaVersion":"0.1.0","scoring":{"passingScore":80}}